{"activation":{"activation_work_package":"WS6.15","allowed_triggers":["workflow_dispatch"],"automatic_triggers_enabled":false,"final_release_verified":false,"hosted_branch_protection_configured":false,"manual_dispatch_must_fail":true,"permanent_release_work_package":"WS6.16","state":"reserved_fail_closed"},"authority_evidence":[{"bytes":6133,"git_blob_sha":"e02f6960fea626ca4c579343e3d68347ad5bda96","path":"README.md"},{"bytes":5285,"git_blob_sha":"7e50012d403a7655574dad47a2be0eef6e42f018","path":"docs/00-START-HERE.md"},{"bytes":6552,"git_blob_sha":"942e6803722fa919dea0e9a2ed3513e42be12f43","path":"docs/14-CODEX-KICKOFF.md"},{"bytes":6180,"git_blob_sha":"248030f5bf7855f631dcf93467dd64e8d1aa62de","path":"docs/19-PHASE-0-VALIDATION-ADDENDUM.md"},{"bytes":9129,"git_blob_sha":"c5ac29ce6d50514954d6bd08b9b56e768b04dc91","path":"docs/20-DEVELOPMENT-STATUS.md"},{"bytes":7366,"git_blob_sha":"b84bd6847cb0f88140e90b8c57bd1ecdf3a38984","path":"handoff/codex-phase0-hosted-controls-issue-final.md"}],"authority_surface_count":6,"authority_surfaces":["README.md","docs/00-START-HERE.md","docs/14-CODEX-KICKOFF.md","docs/19-PHASE-0-VALIDATION-ADDENDUM.md","docs/20-DEVELOPMENT-STATUS.md","handoff/codex-phase0-hosted-controls-issue-final.md"],"base_main_sha":"08f043b8dd1102bebd0186d3fc52041261f51920","boundaries":{"autonomous_merge_authorized":false,"codex_start_authorized":false,"external_actions_authorized":false,"founder_accountability_preserved":true,"hermes_activation_authorized":false,"northstar_implementation_authorized":false,"oauth_authorized":false,"paid_services_authorized":false,"phase0_implementation_authorized":false,"phase0_merge_authorized":false,"phase1_authorized":false,"production_deployment_authorized":false,"real_client_data_enabled":false,"runtime_activation_authorized":false},"canonical_branch":"main","canonical_identity":{"identity_is_case_sensitive":true,"identity_is_whitespace_sensitive":true,"job_key":"validate-final-pre-codex","job_name":"Validate final pre-Codex canonical handoff and complete release","workflow_file":".github/workflows/workstream6-final-pre-codex.yml","workflow_name":"Final pre-Codex canonical handoff and release"},"canonical_status_phrase":"Chat-first development is complete through CF-P1–7, PCR-01–10, WS-4, WS-5 and WS6.6; final Workstream 6 reconciliation and all manual launch gates remain pending; `codex_start_authorized=false`.","canonical_workflow_observed":{"contains_exit_1":true,"contains_ws615":true,"jobs":{"validate-final-pre-codex":"Validate final pre-Codex canonical handoff and complete release"},"triggers":["workflow_dispatch"],"workflow_name":"Final pre-Codex canonical handoff and release"},"closed_defects":["WS6-CONSIST-003"],"completion":{"all_blocking_defects_closed":false,"all_required_prior_components_pass":true,"canonical_identity_unique":true,"final_reconciliation_complete":false,"final_workflow_active":false,"next_permitted_work_package":"WS6.7","predecessor_identities_superseded":true,"reservation_fail_closed":true,"ws66_complete":true},"contract_id":"WORKSTREAM6-REQUIRED-WORKFLOW-IDENTITY","generated_from":"configs/workstream6-required-workflow-identity.yaml","package_check_rule":{"classification":"package_validation_only","example":"Validate WS6.6 required workflow identity and complete prior components","may_satisfy_final_branch_protection":false},"remaining_blocking_defects":["WS6-BLOCK-006"],"repository":"rayrayxing/offdata-os","required_surface_tokens":{"README.md":["contracts/workstream6-required-workflow-identity.json","WS6.15"],"all":["codex_start_authorized=false","Validate final pre-Codex canonical handoff and complete release"],"docs/00-START-HERE.md":["contracts/workstream6-required-workflow-identity.json","manual-only and deliberately fails"],"docs/14-CODEX-KICKOFF.md":["contracts/workstream6-required-workflow-identity.json","WS6.15"],"docs/19-PHASE-0-VALIDATION-ADDENDUM.md":["contracts/workstream6-required-workflow-identity.json",".github/workflows/workstream6-final-pre-codex.yml"],"docs/20-DEVELOPMENT-STATUS.md":["WS6-CONSIST-003","WS6.7",".github/workflows/workstream6-final-pre-codex.yml"],"handoff/codex-phase0-hosted-controls-issue-final.md":["WS6.6 required workflow identity","WS6.15"]},"rollback":{"after_merge":"Revert WS6.6 as one unit, restore issue #19 from the prior synchronized body, and keep the final workflow inactive and every authorization boundary false.","before_merge":"Close the WS6.6 pull request and delete only governance/workstream6-required-workflow-identity."},"schema_version":"1.0.0","status":"required_workflow_identity_reserved_fail_closed","superseded_required_checks":[{"classification":"retained_predecessor_identity","current":false,"job_name":"Validate complete chat-first Phase 1–7 and PCR-01–10 release","source":"contracts/workstream4-readiness.json"},{"classification":"retained_predecessor_identity","current":false,"job_name":"Validate Codex Phase 0 launch control and complete prior release","source":"Workstream 5 retained launch-control evidence"}],"title":"WS6.6 required workflow identity","work_package_id":"WS6.6","workflow_evidence":[{"bytes":536,"git_blob_sha":"85bb7b2c761f0fb17c7675977be5b7c61a11831a","path":".github/workflows/workstream6-final-pre-codex.yml"},{"bytes":465,"git_blob_sha":"8229b112537bc4365558b34ed6b88e76000afa5d","path":".github/workflows/workstream6-required-workflow-identity.yml"}],"workstream_id":"WORKSTREAM-6"}
